<?xml version="1.0" encoding="UTF-8"?>
<tscan xmlns="http://www.hylps.com/tscan/filter" xmlns:xsi="http://www.w3.org/2001/XMLSchema-instance"
	xsi:schemaLocation="http://www.hylps.com/tscan/filter tsacn.xsd ">
	<version>0.1</version>

	<!-- 
	<condition>
		<name>BX-上海</name>
		<type>BX</type>
		<value>
			<![CDATA[
				http://beijing.baixing.com/huochepiao/?%E5%8F%91%E8%BD%A6%E6%97%A5%E6%9C%9F=&%E8%BD%A6%E6%AC%A1=&%E5%87%BA%E5%8F%91%E5%9F%8E%E5%B8%82=%E5%8C%97%E4%BA%AC&%E5%88%B0%E8%BE%BE%E5%9F%8E%E5%B8%82=%E4%B8%8A%E6%B5%B7
			]]>
		</value>
	</condition>
	-->
	
	<condition>
		<name>GJ-武汉</name>
		<type>G</type>
		<value>
			<![CDATA[
				http://bj.ganji.com/piao/zz_%E5%8C%97%E4%BA%AC-%E6%AD%A6%E6%B1%89/
			]]>
		</value>
	</condition>
	
	<condition>
		<name>58-武汉</name>
		<type>58</type>
		<value>
			<![CDATA[
				http://huoche.58.com/beijing-wuhan/
			]]>
		</value>
	</condition>

	<condition>
		<name>KX-武汉</name>
		<type>K</type>
		<value>
			<![CDATA[
				http://huoche.kuxun.cn/zhuanrang-beijing-wuhan.html
			]]>
		</value>
	</condition>

	<condition>
		<name>PW-武汉</name>
		<type>H</type>
		<value>
			<![CDATA[
				http://www.huochepiao.com.cn/search.asp?chufa=%B1%B1%BE%A9&daoda=%CE%E4%BA%BA&piaoyuan=%BB%F0%B3%B5%C6%B1%D4%B4%B2%E9%D1%AF
			]]>
		</value>
	</condition>

	<condition>
		<name>PM-武汉</name>
		<type>HMAIN</type>
		<value>
			<![CDATA[
				http://www.huochepiao.com/City/Search.asp?leixing=%D7%AA%C8%C3&chufa=%B1%B1%BE%A9&daoda=%CE%E4%BA%BA&psearch=%C6%B1%D4%B4%BC%EC%CB%F7
			]]>
		</value>
		<desc>bejing to shanghai</desc>
	</condition>

	<filter>
		<group id="1">
			<rule type="include">10-01</rule>
			<rule type="include">10-1</rule>
			<rule type="include">9-30</rule>

			<rule type="exclude">站票</rule>
			<rule type="exclude">硬座</rule>
			<rule type="exclude">汉口</rule>
		</group>
<!--
		<group id="2">
			<rule type="include">1-29</rule>
			<rule type="exclude">硬卧</rule>
			<rule type="exclude">T49</rule>
		</group>
			-->
	</filter>

</tscan>